{
  "clusters": [
    {
      "cluster_type": "strategy_tag",
      "count": 27,
      "label": "⏱️ Intraday Trend | 1H",
      "share": 0.628
    },
    {
      "cluster_type": "strategy_tag",
      "count": 16,
      "label": "⏱️ Intraday Breakout | 1H",
      "share": 0.372
    }
  ],
  "concentration": {
    "candidate_count": 43,
    "strategy_distribution": {
      "⏱️ Intraday Breakout | 1H": 16,
      "⏱️ Intraday Trend | 1H": 27
    },
    "top_strategy": "⏱️ Intraday Trend | 1H",
    "top_strategy_share": 0.628,
    "trend_distribution": {
      "DOWN": 1,
      "SIDE": 6,
      "UP": 36
    },
    "weak_candidate_count": 0,
    "weak_candidate_ratio": 0.0
  },
  "produced_at": "2026-04-07T08:34:30.590514+00:00",
  "quality_notes": [
    "Total candidates: 43",
    "Weak-score candidates (<55): 0 (0.0%)",
    "Top strategy cluster: ⏱️ Intraday Trend | 1H (27/43)"
  ],
  "run_context": {
    "as_of_date": "2026-04-07",
    "code_version": "bridge-v1",
    "created_at": "2026-04-07T08:34:27.680317+00:00",
    "market": "KOSDAQ",
    "model_version": "legacy",
    "run_id": "RUN-B73C8667",
    "strategy_version": "legacy-ui-v1"
  },
  "warnings": []
}