{
  "clusters": [
    {
      "cluster_type": "strategy_tag",
      "count": 1,
      "label": "🎣 OBV_DIV | Profile:POSITIVE | Ranker:10.7%",
      "share": 0.1
    },
    {
      "cluster_type": "strategy_tag",
      "count": 1,
      "label": "🎣 OBV_DIV | Profile:POSITIVE | Ranker:7.7%",
      "share": 0.1
    },
    {
      "cluster_type": "strategy_tag",
      "count": 1,
      "label": "🚀 Momentum | Profile:NEGATIVE | Ranker:2.5%",
      "share": 0.1
    }
  ],
  "concentration": {
    "candidate_count": 10,
    "strategy_distribution": {
      "🎣 OBV_DIV | Profile:POSITIVE | Ranker:10.7%": 1,
      "🎣 OBV_DIV | Profile:POSITIVE | Ranker:7.7%": 1,
      "🚀 Momentum | Profile:NEGATIVE | Ranker:2.5%": 1,
      "🚀 Momentum | Profile:POSITIVE | Ranker:14.1%": 1,
      "🚀 Momentum | Profile:POSITIVE | Ranker:6.6%": 1,
      "🚀 Momentum | Ranker:3.7%": 1,
      "🚀 Momentum | Ranker:5.2%": 1,
      "🚀 Momentum | ⚡ 단기과열(강세) | Ranker:3.7%": 1,
      "🚀 Momentum | ⚡ 단기과열(강세) | Ranker:5.2%": 1,
      "🚀 Momentum | ⚡ 단기과열(강세) | Ranker:6.8%": 1
    },
    "top_strategy": "🎣 OBV_DIV | Profile:POSITIVE | Ranker:10.7%",
    "top_strategy_share": 0.1,
    "trend_distribution": {
      "UP": 10
    },
    "weak_candidate_count": 2,
    "weak_candidate_ratio": 0.2
  },
  "produced_at": "2026-04-02T15:45:44.053176+00:00",
  "quality_notes": [
    "Total candidates: 10",
    "Weak-score candidates (<55): 2 (20.0%)",
    "Top strategy cluster: 🎣 OBV_DIV | Profile:POSITIVE | Ranker:10.7% (1/10)"
  ],
  "run_context": {
    "as_of_date": "2026-04-03",
    "code_version": "bridge-v1",
    "created_at": "2026-04-02T15:45:40.853433+00:00",
    "market": "KOSPI",
    "model_version": "legacy",
    "run_id": "RUN-95DB0257",
    "strategy_version": "legacy-ui-v1"
  },
  "warnings": []
}