{
  "clusters": [],
  "concentration": {
    "candidate_count": 0,
    "strategy_distribution": {},
    "top_strategy": "UNKNOWN",
    "top_strategy_share": 0.0,
    "trend_distribution": {},
    "weak_candidate_count": 0,
    "weak_candidate_ratio": 1.0
  },
  "produced_at": "2026-03-30T15:06:16.826069+00:00",
  "quality_notes": [
    "Total candidates: 0",
    "Weak-score candidates (<55): 0 (100.0%)",
    "Top strategy cluster: UNKNOWN (0/1)"
  ],
  "run_context": {
    "as_of_date": "2026-03-31",
    "code_version": "non-ui-scan-v1",
    "created_at": "2026-03-30T15:06:08.558996+00:00",
    "market": "NASDAQ",
    "model_version": "legacy",
    "run_id": "RUN-814D1036",
    "strategy_version": "legacy-cli-v1"
  },
  "warnings": [
    {
      "code": "NO_CANDIDATES",
      "message": "Scanner produced zero candidates. Investigate filter coupling or data fetch failures.",
      "severity": "error"
    }
  ]
}