{
  "clusters": [
    {
      "cluster_type": "strategy_tag",
      "count": 1,
      "label": "👑 주도주 하이패스 | ⚡ 단기과열(강세) | Ranker:42.3%",
      "share": 0.5
    },
    {
      "cluster_type": "strategy_tag",
      "count": 1,
      "label": "👑 주도주 하이패스 | ⚡ 단기과열(강세) | Ranker:35.0%",
      "share": 0.5
    },
    {
      "breadth_score": 12.0,
      "cluster_type": "theme",
      "concentration_score": 100.0,
      "leader_ticker": "036170.KQ",
      "member_count": 1,
      "notes": [
        "top_direction=NEUTRAL"
      ],
      "theme_name": "반도체",
      "theme_strength_score": 0.0
    },
    {
      "breadth_score": 12.0,
      "cluster_type": "theme",
      "concentration_score": 100.0,
      "leader_ticker": "388790.KQ",
      "member_count": 1,
      "notes": [
        "top_direction=NEUTRAL"
      ],
      "theme_name": "통신/네트워크",
      "theme_strength_score": 0.0
    }
  ],
  "concentration": {
    "candidate_count": 2,
    "strategy_distribution": {
      "👑 주도주 하이패스 | ⚡ 단기과열(강세) | Ranker:35.0%": 1,
      "👑 주도주 하이패스 | ⚡ 단기과열(강세) | Ranker:42.3%": 1
    },
    "theme_distribution": {
      "반도체": 1,
      "통신/네트워크": 1
    },
    "top_strategy": "👑 주도주 하이패스 | ⚡ 단기과열(강세) | Ranker:42.3%",
    "top_strategy_share": 0.5,
    "trend_distribution": {
      "UP": 2
    },
    "weak_candidate_count": 0,
    "weak_candidate_ratio": 0.0
  },
  "leaderboard": [
    {
      "leader_ticker": "036170.KQ",
      "member_count": 1,
      "theme_name": "반도체",
      "theme_strength_score": 0.0,
      "top_members": [
        {
          "leader_score": 100.0,
          "score": 82.3,
          "theme_direction": "NEUTRAL",
          "theme_strength_score": 0.0,
          "ticker": "036170.KQ"
        }
      ]
    },
    {
      "leader_ticker": "388790.KQ",
      "member_count": 1,
      "theme_name": "통신/네트워크",
      "theme_strength_score": 0.0,
      "top_members": [
        {
          "leader_score": 100.0,
          "score": 99.3,
          "theme_direction": "NEUTRAL",
          "theme_strength_score": 0.0,
          "ticker": "388790.KQ"
        }
      ]
    }
  ],
  "produced_at": "2026-04-13T11:04:07.943950+00:00",
  "quality_notes": [
    "Total candidates: 2",
    "Weak-score candidates (<55): 0 (0.0%)",
    "Top strategy cluster: 👑 주도주 하이패스 | ⚡ 단기과열(강세) | Ranker:42.3% (1/2)",
    "Top theme cluster: 반도체 (1/2)"
  ],
  "run_context": {
    "as_of_date": "2026-04-13",
    "code_version": "bridge-v1",
    "created_at": "2026-04-13T11:03:35.026194+00:00",
    "market": "KOSDAQ",
    "model_version": "legacy",
    "run_id": "RUN-29713CCC",
    "strategy_version": "legacy-ui-v1"
  },
  "warnings": []
}