{
  "clusters": [
    {
      "cluster_type": "strategy_tag",
      "count": 1,
      "label": "🚀 Momentum",
      "share": 1.0
    }
  ],
  "concentration": {
    "candidate_count": 1,
    "strategy_distribution": {
      "🚀 Momentum": 1
    },
    "top_strategy": "🚀 Momentum",
    "top_strategy_share": 1.0,
    "trend_distribution": {
      "UP": 1
    },
    "weak_candidate_count": 0,
    "weak_candidate_ratio": 0.0
  },
  "produced_at": "2026-03-30T12:28:39.111166+00:00",
  "quality_notes": [
    "Total candidates: 1",
    "Weak-score candidates (<55): 0 (0.0%)",
    "Top strategy cluster: 🚀 Momentum (1/1)"
  ],
  "run_context": {
    "as_of_date": "2026-03-30",
    "code_version": "bridge-v1",
    "created_at": "2026-03-30T12:28:39.110540+00:00",
    "market": "US",
    "model_version": "legacy",
    "run_id": "RUN-9F553849",
    "strategy_version": "bridge-smoke-v4"
  },
  "warnings": [
    {
      "code": "STRATEGY_CONCENTRATION",
      "message": "Candidates are concentrated in one strategy tag (🚀 Momentum).",
      "severity": "warning"
    }
  ]
}