{
  "clusters": [],
  "concentration": {
    "candidate_count": 0,
    "strategy_distribution": {},
    "top_strategy": "UNKNOWN",
    "top_strategy_share": 0.0,
    "trend_distribution": {},
    "weak_candidate_count": 0,
    "weak_candidate_ratio": 1.0
  },
  "produced_at": "2026-04-01T09:32:22.140513+00:00",
  "quality_notes": [
    "Total candidates: 0",
    "Weak-score candidates (<55): 0 (100.0%)",
    "Top strategy cluster: UNKNOWN (0/1)"
  ],
  "run_context": {
    "as_of_date": "2026-04-01",
    "code_version": "orchestrated-us-research",
    "created_at": "2026-04-01T09:32:22.139679+00:00",
    "market": "AMEX",
    "model_version": "research-baseline",
    "run_id": "RUN-005D9531",
    "strategy_version": "us-research-v1"
  },
  "warnings": [
    {
      "code": "NO_CANDIDATES",
      "message": "Scanner produced zero candidates. Investigate filter coupling or data fetch failures.",
      "severity": "error"
    }
  ]
}