{
  "clusters": [],
  "concentration": {
    "candidate_count": 0,
    "strategy_distribution": {},
    "top_strategy": "UNKNOWN",
    "top_strategy_share": 0.0,
    "trend_distribution": {},
    "weak_candidate_count": 0,
    "weak_candidate_ratio": 1.0
  },
  "produced_at": "2026-03-31T22:57:08.949232+00:00",
  "quality_notes": [
    "Total candidates: 0",
    "Weak-score candidates (<55): 0 (100.0%)",
    "Top strategy cluster: UNKNOWN (0/1)"
  ],
  "run_context": {
    "as_of_date": "2026-04-01",
    "code_version": "bridge-v1",
    "created_at": "2026-03-31T22:57:08.918837+00:00",
    "market": "KOSDAQ",
    "model_version": "legacy",
    "run_id": "RUN-45B1BB3D",
    "strategy_version": "legacy-ui-v1"
  },
  "warnings": [
    {
      "code": "NO_CANDIDATES",
      "message": "Scanner produced zero candidates. Investigate filter coupling or data fetch failures.",
      "severity": "error"
    }
  ]
}